{
  "$schema": "https://json-schema.org/draft/2020-12/schema",
  "$id": "repo_manifest.schema.json",
  "title": "repo_manifest",
  "description": "Identity and provenance of one candidate source tree entering the pipeline.",
  "type": "object",
  "required": ["manifest_id", "device_id", "source_root", "revision", "files"],
  "additionalProperties": false,
  "properties": {
    "manifest_id": {
      "type": "string",
      "description": "Stable id for this intake; derived from device_id + revision + root digest."
    },
    "device_id": {
      "type": "string",
      "description": "Stable identifier of the producing device (e.g. chromebook-crostini, moto-4-5g-2024)."
    },
    "source_root": {
      "type": "string",
      "description": "Absolute path as seen on the producing device. Never silently rewritten."
    },
    "revision": {
      "type": "string",
      "description": "Git revision, or 'norev:<content-digest>' for an unversioned tree."
    },
    "intake_status": {
      "enum": ["discovered", "verified", "quarantined", "rejected"],
      "description": "Lifecycle state. Only 'verified' manifests may feed clustering."
    },
    "files": {
      "type": "array",
      "minItems": 1,
      "items": {
        "type": "object",
        "required": ["path", "sha256", "size_bytes"],
        "additionalProperties": false,
        "properties": {
          "path": {"type": "string", "description": "Path relative to source_root."},
          "sha256": {"type": "string", "pattern": "^[0-9a-f]{64}$"},
          "size_bytes": {"type": "integer", "minimum": 0},
          "language": {"type": "string"}
        }
      }
    },
    "truncated": {
      "type": "boolean",
      "description": "True when a scan bound (count/depth/time) cut the walk short."
    }
  }
}
